{
  "$comment": "Requirement IDs: HEE-KIT-02",
  "version": "1.0.0",
  "contract_version": 1,
  "contract_hash": "056541d662a9f5f64decc14d4061900774fdaa22564f8271e3693fb5ff15d811",
  "generated_at": "2026-10-03T12:00:00.000Z",
  "actions": [
    {
      "name": "list_widgets",
      "title": "List widgets",
      "group": "read",
      "description": "Lists every widget on every shelf with its size in units. Call this before changing anything. Example: list_widgets({}).",
      "input_schema": {
        "type": "object",
        "additionalProperties": false,
        "properties": {}
      },
      "annotations": {
        "readOnly": true,
        "destructive": false,
        "untrustedContent": false
      },
      "dynamic": false
    },
    {
      "name": "add_widget",
      "title": "Add widget",
      "group": "change",
      "description": "Adds a widget to a shelf. Sizes are in whole units. Check capacity afterwards. Example: add_widget({\"name\": \"alpha\", \"shelfId\": \"shelf-a\", \"size\": 1}).",
      "input_schema": {
        "type": "object",
        "additionalProperties": false,
        "properties": {
          "name": {
            "type": "string",
            "description": "Widget name, unique across shelves"
          },
          "shelfId": {
            "type": "string",
            "description": "Target shelf id"
          },
          "size": {
            "type": "integer",
            "description": "Size in whole units"
          }
        },
        "required": [
          "name",
          "shelfId",
          "size"
        ]
      },
      "annotations": {
        "readOnly": false,
        "destructive": false,
        "untrustedContent": false
      },
      "dynamic": false
    },
    {
      "name": "remove_widget",
      "title": "Remove widget",
      "group": "change",
      "description": "Removes a widget from its shelf. This needs the human's approval. Example: remove_widget({\"name\": \"alpha\"}).",
      "input_schema": {
        "type": "object",
        "additionalProperties": false,
        "properties": {
          "name": {
            "type": "string",
            "description": "Widget name to remove"
          }
        },
        "required": [
          "name"
        ]
      },
      "annotations": {
        "readOnly": false,
        "destructive": true,
        "untrustedContent": false
      },
      "dynamic": false
    }
  ],
  "procedures": [
    {
      "name": "stock-shelf",
      "steps": [
        "list_widgets",
        "add_widget",
        "check_shelves"
      ]
    }
  ]
}
